{
  "$schema": "http://json-schema.org/draft-07/schema#",
  "$id": "uefn.handoff.Writer_Scenariste.v1",
  "title": "Writer_Scenariste - contrat du livrable 01_scripts.json",
  "description": "Schema de sortie de l'agent Writer_Scenariste (agent 07, pole Design, phase DESIGN). Enveloppe = uefn.handoff.v1 (util/multi_agent/04-contrat-handoff.md) ; le payload porte l'inventaire des textes definitifs de l'ile. CE SCHEMA NE VALIDE JAMAIS LA QUALITE LITTERAIRE : la prose (ton d'un lore, style d'une replique) est difficile a decrire par un schema, elle s'apprend par few-shot prompting (util/multi_agent/03-parametrage-agents.md section 4, 'several examples of input text and the ideal, high-fidelity output'). Ce fichier ne valide que la STRUCTURE TRANSPORTABLE : une cle de chaine stable par ligne, une destination dans l'enum, une longueur sous le gabarit, des variables d'inline declarees et non resolues a la main, un locuteur designe par un label existant. La conformite du ton est jugee par les exemples de skill/exemples/ et par le critique externe, jamais par une contrainte de motif regex. Agent Design : acces_mcp = none, donc aucune coordonnee, aucun chemin d'asset, aucun PPID_/PID_ final.",
  "type": "object",
  "additionalProperties": false,
  "required": [
    "$schema",
    "handoff_id",
    "from",
    "to",
    "artifact",
    "mission_ref",
    "summary_short",
    "payload",
    "constraints",
    "acceptance",
    "next_step_hint",
    "context_budget_tokens"
  ],
  "properties": {
    "$schema": { "const": "uefn.handoff.v1" },
    "handoff_id": { "type": "string", "pattern": "^H-[A-Z]+-[0-9]{3,}$" },
    "from": { "const": "Writer_Scenariste" },
    "to": {
      "type": "array",
      "minItems": 1,
      "items": {
        "enum": [
          "Producer_Orchestrator",
          "Creative_Director",
          "Game_Designer",
          "System_Designer",
          "Economy_Designer",
          "Mission_Content_Designer",
          "Narrative_Designer",
          "Writer_Scenariste",
          "UX_UI_Designer",
          "Level_Designer",
          "Engine_Programmer",
          "Lead_Programmer",
          "Gameplay_Programmer",
          "AI_Programmer",
          "UI_Programmer",
          "Graphics_Programmer",
          "Physics_Programmer",
          "Audio_Director",
          "Composer",
          "Sound_Designer",
          "Voice_Designer"
        ]
      }
    },
    "artifact": { "const": "01_scripts.json" },
    "mission_ref": { "type": "string", "minLength": 1 },
    "summary_short": { "type": "string", "minLength": 1, "maxLength": 200 },
    "payload": {
      "type": "object",
      "additionalProperties": false,
      "required": ["lignes", "inventaire_par_ecran", "contraintes_de_place", "ton_reference"],
      "properties": {
        "lignes": {
          "type": "array",
          "minItems": 1,
          "items": { "$ref": "#/definitions/ligne" },
          "description": "Inventaire exhaustif des chaines a livrer. Une ligne par chaine consommable. Une chaine absente ici n'existe pas pour l'UI_Programmer (14) ni pour le Voice_Designer (20)."
        },
        "inventaire_par_ecran": {
          "type": "array",
          "minItems": 1,
          "items": { "$ref": "#/definitions/ecran" },
          "description": "Regroupement par ecran/panneau affiche. Doit rester coherent avec lignes (toute cle de ligne apparait dans un ecran). C'est la clef du contrat avec l'agent 14 : un texte qui exige plus d'une chaine par ecran obligera 14 a retoucher son propre .verse."
        },
        "contraintes_de_place": { "$ref": "#/definitions/contraintes_de_place" },
        "ton_reference": { "$ref": "#/definitions/ton_reference" }
      }
    },
    "constraints": {
      "type": "object",
      "additionalProperties": true,
      "required": ["acces_mcp", "must_preserve", "forbidden"],
      "properties": {
        "acces_mcp": { "const": "none", "description": "Agent Design : aucun appel MCP, aucune ecriture dans l'editeur ni dans un .verse." },
        "must_preserve": { "type": "array", "minItems": 1, "items": { "type": "string" } },
        "forbidden": { "type": "array", "items": { "type": "string" } },
        "must_ask_producer": {
          "type": "array",
          "items": { "type": "string" },
          "description": "Questions bloquantes remontees au Producteur (registre, langue, presence d'un narrateur). Jamais posees a l'utilisateur en direct. 15 max par phase."
        },
        "gaps_de_perimetre": {
          "type": "array",
          "items": { "type": "string" },
          "description": "Textes requis en amont mais non emis (ex. 01_scripts.json jamais produit pendant une run geometrique) : declare, pas invente."
        }
      }
    },
    "golden_example_ref": { "type": "string" },
    "exemple_annotations": {
      "type": "object",
      "additionalProperties": true,
      "description": "Cle reservee aux fichiers de skill/exemples/ (commentaire pedagogique : pourquoi cet exemple passe ou echoue, source reelle du payload, contrainte d'encodage ASCII). Ne doit jamais apparaitre dans un handoff reel."
    },
    "acceptance": {
      "type": "array",
      "minItems": 4,
      "items": {
        "enum": [
          "all_lines_carry_stable_string_key",
          "all_lines_carry_destination_in_enum",
          "all_lines_carry_locuteur_label_not_coordinate",
          "no_hardcoded_computed_number",
          "inline_variables_declared",
          "no_line_exceeds_display_gabarit",
          "no_duplicate_or_overwritten_string_key",
          "inventaire_par_ecran_counts_match_lines",
          "npc_replication_only_if_npc_exists",
          "missing_data_marked_unknown_not_invented",
          "no_coordinate_game_path_or_final_pid",
          "delivered_text_is_ascii_encodable",
          "ton_reference_has_in_ton_and_off_tone_pair"
        ]
      },
      "description": "Criteres cochables par du code (compter, verifier une enum, verifier qu'une variable d'inline est declaree, verifier qu'aucune chaine ne depasse le gabarit). Jamais 'c'est bien ecrit' : la valeur litteraire n'est pas un critere d'acceptance."
    },
    "next_step_hint": { "type": "string", "maxLength": 400 },
    "context_budget_tokens": { "type": "integer", "maximum": 4000 }
  },
  "definitions": {
    "ligne": {
      "type": "object",
      "additionalProperties": false,
      "required": ["cle", "destination", "locuteur", "texte", "longueur_cm_estimate", "variables_inline_declarees", "statut"],
      "properties": {
        "cle": {
          "type": "string",
          "pattern": "^[a-z][a-z0-9_]*(\\.[a-z][a-z0-9_]*)+$",
          "description": "Clef de chaine stable que l'UI_Programmer (14) branche sans recalcul. Espace reserve : ui_hud.*, ui_menus.*, ui_panneaux.*, voix.*, sous_titres.*. Une cle qui en ecrase une deja publiee est un motif de rejet."
        },
        "destination": {
          "enum": ["hud", "menu", "panneau_in_world", "sous_titre", "voix"],
          "description": "Ou la chaine est consommee. Sans destination, la ligne est inconsommable par l'agent 14 : rejet."
        },
        "locuteur": {
          "type": "string",
          "pattern": "^(?!.*(/Game/|PPID_|PID_|-?[0-9]+\\.[0-9]+,-?[0-9]+\\.[0-9]+)).+$",
          "description": "Qui parle, designe par un label existant amont (01_lore.json / characters.md / 01_missions.json) ou par 'systeme_ui' pour une chaine sans personnage. Jamais une coordonnee ni un nom d'asset ; 'UNKNOWN' si aucun locuteur n'est valide en amont."
        },
        "texte": {
          "type": "string",
          "description": "Le texte definitif livr. Vide ou 'UNKNOWN' si statut != REDIGE. Toute valeur chifquee calculee par le gameplay doit etre une variable d'inline ({score}, {timer}), jamais un nombre ecrit a la main."
        },
        "longueur_cm_estimate": {
          "const": "UNKNOWN",
          "description": "INTERDIT de le calculer ici : la mesure de place d'affichage depend du device HUD reel (gabarit fourni par UX_UI_Designer 08 puis UI_Programmer 14). Ce champ reste donc 'UNKNOWN' ; le scenario livre le texte et ses variables, pas un rendu mesure."
        },
        "variables_inline_declarees": {
          "type": "array",
          "items": { "type": "string", "pattern": "^\\{[a-z][a-z0-9_]*\\}$" },
          "description": "Les placeholders {nom} presents dans texte, declares explicitement. Une variable utilisee mais non declaree, ou un nombre inline non declare, = UNKNOWN et motif de rejet : le nombre vient du gameplay, jamais du scenario."
        },
        "statut": {
          "enum": ["REDIGE", "NON_REDIGE", "UNKNOWN"],
          "description": "REDIGE = texte final livr. NON_REDIGE = texte requis au brief mais volontairement absent du perimetre (ex. aucune replique de PNJ : aucun PNJ programme). UNKNOWN = donnee amont manquante, jamais inventee."
        },
        "doublable": { "type": "boolean", "description": "true si Voice_Designer (20) doit l'enregistrer ; false si affiche-only. Obligatoire quand destination = voix." },
        "ref_amont": { "type": "string", "description": "Reference a la source amont qui legitimise la ligne (zone_id de 01_gdd.json, id de 01_lore.json, id de 01_missions.json). 'UNKNOWN' si aucune." }
      }
    },
    "ecran": {
      "type": "object",
      "additionalProperties": false,
      "required": ["ecran", "cles"],
      "properties": {
        "ecran": { "type": "string", "minLength": 2, "description": "Nom de l'ecran ou du panneau affiche (ex. ecran_menu, carton_memorial, panneau_zone_west)." },
        "cles": {
          "type": "array",
          "minItems": 1,
          "items": { "type": "string" },
          "description": "Les cles de lignes branches sur cet ecran. Le compte doit correspondre au nombre de lignes de meme ecran ; sinon 14 doit retoucher son .verse = motif de rejet."
        }
      }
    },
    "contraintes_de_place": {
      "type": "object",
      "additionalProperties": false,
      "required": ["max_caracteres_par_chaine", "max_chaines_par_ecran", "gabarit_source"],
      "properties": {
        "max_caracteres_par_chaine": { "type": "integer", "minimum": 1, "description": "Gabarit d'affichage convenu avec UX_UI_Designer (08). Le validateur Python verifie chaque texte contre cette borne." },
        "max_chaines_par_ecran": { "type": "integer", "minimum": 1, "description": "Nombre de chaines par ecran que l'agent 14 peut brancher sans retoucher son .verse." },
        "gabarit_source": { "type": "string", "minLength": 3, "description": "D'ou vient le gabarit (handoff 08, 09, tech/mcp-inventory.json) ou 'UNKNOWN' si non fourni." },
        "encodage": { "type": "string", "enum": ["ascii", "utf-8"], "description": "Contrainte d'encodage du PAQUET (exemple en ascii pur pour les .json), pas une regle d'ecriture du jeu. Signale dans exemple_annotations pour que le lecteur ne croie pas le ton casse." }
      }
    },
    "ton_reference": {
      "type": "object",
      "additionalProperties": false,
      "required": ["registre", "exemple_correct", "exemple_hors_ton", "motif_hors_ton"],
      "description": "Few-shot : la MEME replique livree en version conforme au ton de 00_vision.json et en version hors ton. C'est ici que le ton s'apprend, par exemple, pas par une regex : 03-parametrage-agents.md section 4 reserve le schema a la structure et le few-shot a ce qui est difficile a decrire.",
      "properties": {
        "registre": { "type": "string", "minLength": 8 },
        "exemple_correct": {
          "type": "object",
          "additionalProperties": false,
          "required": ["cle", "texte"],
          "properties": { "cle": { "type": "string" }, "texte": { "type": "string" } }
        },
        "exemple_hors_ton": {
          "type": "object",
          "additionalProperties": false,
          "required": ["cle", "texte"],
          "properties": { "cle": { "type": "string" }, "texte": { "type": "string" } }
        },
        "motif_hors_ton": { "type": "string", "minLength": 8, "description": "Pourquoi la seconde version contredit 00_vision.json (ton, anti_references) et doit passer par une derogation via le Producteur, jamais etre livree telle quelle." }
      }
    }
  }
}
